{
  "schemaVersion": "chatgpt.browser_control.operation_artifact_receipt.v1",
  "operationId": "11111111-1111-4111-8111-111111111111",
  "artifactKey": "artifact-0",
  "assistantTurnId": "assistant-turn-1",
  "sourceIdentityDigest": "hmac-sha256:abababababababababababababababababababababababababababababababab",
  "kind": "file",
  "ordinal": 0,
  "outputKey": "operation-11111111-result.bin",
  "mimeType": "application/octet-stream",
  "bytes": 32,
  "sha256": "dddddddddddddddddddddddddddddddddddddddddddddddddddddddddddddddd",
  "status": "transferred"
}
